,"trading.struct.api (https://www.notion.so/trading-struct-api-8c6306c7c9d049ccb1dc857ef7c77da7), trading.offer.api (https://www.notion.so/trading-offer-api-c28cf877b5fc48f7a1285fbe88b7ed10), trading.struct.audit-api (https://www.notion.so/trading-struct-audit-api-da2a3305e2134c0fa1a93fb47fadb8e6), trading.events.api (https://www.notion.so/trading-events-api-d79f7b8046654cf580761b0d91ac88e0), trading.templates.api (https://www.notion.so/trading-templates-api-c066d888457d4dddbf5f95e6856b4faf)",UI,trading.struct.web-ui,,,Production,High,Trading,Everything Struct UI.,
Imports engine code for access to storage.,trading.suggestions.engine (https://www.notion.so/trading-suggestions-engine-c154cdc68e5a4ec1a66a7ebea735f360),"HTTP Server, MySQL",trading.suggestions.api,,,Production,Unknown,Trading,Serves odd suggestion data read from storage saved by the suggestions engine.,2
,"trading.events.api (https://www.notion.so/trading-events-api-d79f7b8046654cf580761b0d91ac88e0), trading.suggestions.api (https://www.notion.so/trading-suggestions-api-cf8500bc54514547bb84923ceb3c99d5)","Consumer, Cron, Engine, HTTP Client, MySQL",trading.suggestions.engine,,,Production,Unknown,Trading,Stores odd prices provided by feeds.,2
,trading.supergames.engine (https://www.notion.so/trading-supergames-engine-5cba1f8a19944eab90a88e09d2d80b18),"DynamoDB, Producer, gRPC Server",trading.supergames.api,Anton Ružman,,Production,Medium,Trading,"Manages supergames related information. If it fails, market updates are not processed so supergame market state becomes stale.",2
Updates market templates if supergame markets are not found.,"trading.supergames.api (https://www.notion.so/trading-supergames-api-36d9d651d90a4374b73acf342405c05f), trading.price.api (https://www.notion.so/trading-price-api-8b02ead64f3f4690b88f2efc6771d081), trading.offer.api (https://www.notion.so/trading-offer-api-c28cf877b5fc48f7a1285fbe88b7ed10)","Consumer, Engine, HTTP Client, Producer, gRPC Client",trading.supergames.engine,Anton Ružman,,Production,Medium,Trading,Processes offer topics to calculate market updates for supergame markets.,3
,,"Consumer, Engine, HTTP Client, Producer, Supersoft Integration",trading.supergames.supersoft-sync,Anton Ružman,,Production,Low,Trading,Imports supergames information into Supersoft so it is available for printing and restrictions are generated.,1
,,"Cron, MySQL, Producer, Supersoft Integration",trading.supersoft.pregame-adapter,,,Production,Low,Trading,"Fetches fixture information from legacy supersoft database and produces them into the universal event feed. With all the fixtures in Supersoft being imported from Bookie, the only information used from Supersoft are the match entering codes.",2
,"trading.struct.web-ui (https://www.notion.so/trading-struct-web-ui-a5b76861e1704973b058e719804c90bb), trading.struct.api (https://www.notion.so/trading-struct-api-8c6306c7c9d049ccb1dc857ef7c77da7), trading.templates.tracer (https://www.notion.so/trading-templates-tracer-ac08d28f672643c39c28a1a011bbcf4c)","Cron, HTTP Client, HTTP Server, Producer, Redis",trading.templates.api,,,Production,Low,Trading,Provides event market template manipulation tools.,2
,trading.templates.api (https://www.notion.so/trading-templates-api-c066d888457d4dddbf5f95e6856b4faf),"Consumer, Engine, HTTP Client",trading.templates.tracer,,,Production,Low,Trading,Updates event and market template information with trading.templates.api,1
,,,trading.templates.web-ui,,,Abandoned,None,,,
,trading.offer.web-ui (https://www.notion.so/trading-offer-web-ui-29f7a73112d3485a8b7ab79e18ea5a56),"HTTP Server, MySQL, Producer",trading.traders.api,,,Production,Medium,,Manages bookie users’ personalisation data.,2
,offer.specials.print-engine (https://www.notion.so/offer-specials-print-engine-96519ced232b41209b88a25d751a8f33),"Consumer, DynamoDB, Engine, HTTP Server",trading.translations.api,,,Production,Low,Trading,Provides name transformation tools used for importing specials data into Supersoft.,2
,,"Consumer, DynamoDB, Engine, Producer",trading.txodds.adapter,,,Production,Low,Trading,Processes raw txodds data and generates universal event messages.,3
,,,trading.txodds.early-pricing,,,Development,,Trading,,
,,,trading.txodds.event,,,Development,,Trading,,
,,,trading.txodds.event-api,,,Development,,Trading,,
,,"Cron, HTTP Client, MySQL, Producer, TxOdds Integration",trading.txodds.fetcher,,,Production,Low,Trading,Periodically fetches struct data from txodds and writes it into a local txodds struct topic.,2
,,"Consumer, DynamoDB, Engine, HTTP Server",trading.txodds.flush,,,Production,Low,Trading,Consumes raw txodds topic and stores to dynamodb. Has an endpoint to flush those values back to that same topic.,1
,,"Producer, STOMP, TxOdds Integration",trading.txodds.importer,,,Production,Low,Trading,Imports txodds event data and produces to raw txodds kafka topic.,2
,,"Consumer, DynamoDB, Engine",trading.txodds.mappings,,,Production,Low,Trading,Consumes bookie struct feed and stores mappings to txodds.,1
,,"DynamoDB, HTTP Server",trading.txodds.template-api,,,Production,Low,Trading,Stores txodds specific templates.,2
,,UI,trading.txodds.web-ui,,,Production,Low,Trading,TxOdds configuration UI.,
,,,trading.universal.api,,,Development,,,,
